### ISSUE TITLE
Slow TLS handshake and initial data sending and receiving

### ISSUE THREAD

**Issue by Ono-Sendai** [libressl/portable#1143]
Hi all,
I have an application connecting to a server, both built with LibreSSL / LibTLS version 3.5.2.
Since the server is physically far away from my test client machine, the round-trip time is quite high (300 ms).

`Reply from 142.132.192.161: bytes=32 time=301ms TTL=53`

The tls handshake (tls_handshake()) is taking more than 600 ms though, e.g. 2 round-trip times.

```
Client TLS handshake took 0.6403 s
tls_conn_cipher: TLS_AES_256_GCM_SHA384
tls_conn_version: TLSv1.3
```

It reports that it's using TLS 1.3, so shouldn't the handshake take just about 1 RTT?   Why is it taking 2 RTT?

In addition to that, after the handshake completes, the client sends a small amount of data (e.g. 20 bytes or so) to the server, and the server replies with around 20 bytes as soon as it receives that data.   This send and receive takes about 600ms as well, when it should take about 300ms.

What's going on here?

**Comment by Ono-Sendai** [comment]
TLS handshake to the same software running on localhost takes 25ms:

```
Client TLS handshake took 0.02519 s
tls_conn_cipher: TLS_CHACHA20_POLY1305_SHA256
tls_conn_version: TLSv1.3
```

**Comment by Ono-Sendai** [comment]
Anyone have any ideas?
Here's a wireshark log:

```
52	1743923686.000	2.337	0.001	192.168.1.104	142.132.192.161	TCP	66	56158 → 7600 [SYN] Seq=0 Win=65280 Len=0 MSS=1360 WS=256 SACK_PERM
53	1743923686.076	2.413	0.076	192.168.1.104	142.132.192.161	UDP	46	54572 → 7601 Len=4
54	1743923686.303	2.640	0.226	142.132.192.161	192.168.1.104	TCP	66	7600 → 56158 [SYN, ACK] Seq=0 Ack=1 Win=64240 Len=0 MSS=1452 SACK_PERM WS=128
55	1743923686.303	2.640	0.000	192.168.1.104	142.132.192.161	TCP	54	56158 → 7600 [ACK] Seq=1 Ack=1 Win=262400 Len=0
56	1743923686.303	2.641	0.000	192.168.1.104	142.132.192.161	TLSv1.3	291	Client Hello (SNI=substrata.info)
59	1743923686.603	2.940	0.221	142.132.192.161	192.168.1.104	TCP	60	7600 → 56158 [ACK] Seq=1 Ack=238 Win=64128 Len=0
60	1743923686.603	2.941	0.000	142.132.192.161	192.168.1.104	TLSv1.3	181	Server Hello
61	1743923686.603	2.941	0.000	142.132.192.161	192.168.1.104	TLSv1.3	1414	Change Cipher Spec, Application Data
62	1743923686.603	2.941	0.000	142.132.192.161	192.168.1.104	TCP	1414	7600 → 56158 [PSH, ACK] Seq=1488 Ack=238 Win=64128 Len=1360 [TCP PDU reassembled in 66]
63	1743923686.603	2.941	0.000	192.168.1.104	142.132.192.161	TCP	54	56158 → 7600 [ACK] Seq=238 Ack=2848 Win=262400 Len=0
64	1743923686.603	2.941	0.000	142.132.192.161	192.168.1.104	TCP	1414	7600 → 56158 [ACK] Seq=2848 Ack=238 Win=64128 Len=1360 [TCP PDU reassembled in 66]
65	1743923686.603	2.941	0.000	192.168.1.104	142.132.192.161	TCP	54	56158 → 7600 [ACK] Seq=238 Ack=4208 Win=262400 Len=0
66	1743923686.605	2.942	0.001	142.132.192.161	192.168.1.104	TLSv1.3	1414	Application Data
70	1743923686.652	2.990	0.032	192.168.1.104	142.132.192.161	TCP	54	56158 → 7600 [ACK] Seq=238 Ack=5568 Win=262400 Len=0
84	1743923686.902	3.240	0.029	142.132.192.161	192.168.1.104	TLSv1.3	170	Application Data, Application Data
85	1743923686.903	3.240	0.000	192.168.1.104	142.132.192.161	TLSv1.3	60	Change Cipher Spec
87	1743923687.202	3.540	0.272	142.132.192.161	192.168.1.104	TCP	60	7600 → 56158 [ACK] Seq=5684 Ack=244 Win=64128 Len=0
88	1743923687.202	3.540	0.000	192.168.1.104	142.132.192.161	TLSv1.3	232	Application Data, Application Data, Application Data, Application Data, Application Data
96	1743923687.502	3.840	0.066	142.132.192.161	192.168.1.104	TCP	60	7600 → 56158 [ACK] Seq=5684 Ack=422 Win=64128 Len=0
97	1743923687.502	3.840	0.000	142.132.192.161	192.168.1.104	TLSv1.3	80	Application Data
```

**Comment by Ono-Sendai** [comment]
Note that the duration from initiating the TLS handshake to receiving the initial application response from the server is about 1.2 seconds.  This implies the TLS handshake is actually taking 3 round trip times!    This is 3x slower, or 600ms slower than it should be!

**Comment by Ono-Sendai** [comment]
Here's another run with the initial handshake, plus the simple send cyberspace hello (my protocol) and receive hello response after it:

```
================ Starting TLS handshake at 2106716.8131734 =================
--------------time: 2106716.813558 -----------------------
Client sending ClientHello
--------------time: 2106716.813736 -----------------------
Client receiving ServerHello
Creating UDP socket...
--------------time: 2106717.141229 -----------------------
Client receiving EncryptedExtensions
--------------time: 2106717.141534 -----------------------
Client receiving CertificateRequest
--------------time: 2106717.142994 -----------------------
Client receiving CertificateVerify
--------------time: 2106717.469123 -----------------------
Client receiving Finished
--------------time: 2106717.469735 ----------------------- 0.656 s after handshake start
Client sending Finished
Client TLS handshake took 0.6576 s
tls_conn_cipher: TLS_AES_256_GCM_SHA384
tls_conn_version: TLSv1.3
tls_conn_session_resumed: false
================ Sending CyberspaceHello etc. at 2106717.4726855997 =================  0.659 s after handshake start
================ Finished sending CyberspaceHello etc. at 2106717.4733443 ================= 0.660 s after handshake start
================ Received CyberspaceHello from server at 2106718.1282985997 ================= 1.315 s after handshake start, 0.655 s after sending CyberspaceHello etc
```

As you can see the handshake takes about 2 RTT.   And then the simple hello send and receive after also takes 2 RTT!   (it should just take one of course).
So in total it's 2 RTT slower than it should be.

**Comment by Ono-Sendai** [comment]
Testing connecting to hetzner.de (which has a similar RTT as my server) does result in a 1 RTT TLS handshake.  So this indicates the problem is on my server code (which does use libtls too)

```
Hetzner.de (RTT 315ms)
----------------------

================ Starting TLS handshake at 2115778.5643908 =================
--------------time: 2115778.565051 -----------------------
Client sending ClientHello
--------------time: 2115778.565281 -----------------------
Client receiving ServerHello
--------------time: 2115778.880556 -----------------------
Client receiving EncryptedExtensions
--------------time: 2115778.880913 -----------------------
Client receiving CertificateRequest
--------------time: 2115778.881505 -----------------------
Client receiving CertificateVerify
--------------time: 2115778.883643 -----------------------
Client receiving Finished
--------------time: 2115778.883785 -----------------------
Client sending Finished
Client TLS handshake took 0.3196 s
tls_conn_cipher: TLS_AES_256_GCM_SHA384
tls_conn_version: TLSv1.3
tls_conn_session_resumed: false
```

**Comment by Ono-Sendai** [comment]
OMG.  it was Nagle's algorithm, of course.  I obviously should have taken 'It’s always TCP_NODELAY. Every damn time. ' (https://brooker.co.za/blog/2024/05/09/nagle.html) to heart.
I do enable TCP_NODELAY, but I didn't think to enable it *before* the TLS handshake.  Turns out it matters - enabling it before the handshake on the server results in a 1 RTT handshake.

Ok will close this issue, lets leave this mini-blog as a warning for future readers :)

**Comment by botovq** [comment]
Glad you figured that one out. Thanks for persisting and letting us know what it was.

**Comment by Ono-Sendai** [comment]
haha thanks for reading my debugging blog :)
